{
  "clarification_question": "Do you intend the 'LoadBearing' property or the 'IsExternal' property?",
  "conflicting_candidate_ids": [
    "candidate:1:ifc2x3:Pset_ColumnCommon.LoadBearing",
    "candidate:2:ifc2x3:Pset_ColumnCommon.IsExternal"
  ],
  "decision": "clarification_required",
  "schema_version": "text2ifc/ifc-property-rerank-decision/0.1",
  "selected_candidate_id": null
}
